_id,link,last_seen,ispublished,views,deadline,company_name,content,source,branches_count,display_name,country,industry,revenue_range,employees_range,year_founded,description,longitude,latitude,company_status,revenue,employees_count,technologies_used
,,,,,,http://bayt.com,,,0,"Bayt.com, Inc.",United Arab Emirates,Information Technology and Services,50M - 100M,200 - 500,2000,"Bayt.com is the leading job search platform in the Middle East and North Africa, connecting job seekers with employers looking to hire. Every day, thousands of new job vacancies are listed on the award-winning platform from the region's top employers.",,,active,,,"['Google Tag Manager', 'Varnish']"
,,,,,,http://cobia-uk.com,,,0,COBIA LTD,United Kingdom,Management Consulting,1M - 10M,10 - 50,2008,Friendly and flexible accounting services,,,active,,,['WordPress']
,,,,,,http://weg.net,,,0,WEG SA,Brazil,Computer Hardware,> 1B,"> 10,000",1961,"WEG SA is a Brazil-based holding company principally engaged in the manufacturing of electrical equipment and components. The Company is active, along with its subsidiaries, in the manufacture and marketing of goods, such as electric motors, generators and transformers; reducers, geared reducers, frequency inverters, starter motors and maneuver devices; control and protection of electric circuits and industrial automation; electric traction solutions (land and sea); solutions for the generation of renewable and distributed energy, exploring all opportunities in small hydroelectric plants and thermal biomass, wind and solar energy sources; no-breaks and alternators for groups of generators; electric substations; industrial electrical and electronic equipment systems, and industrial paint & varnish. It is active in Brazil, Argentina, Mexico, the United States, Portugal, Austria, South Africa, India, and China. It operates through Bluffton Motor Works LLC.",,,active,2613956766,31830,"['CloudFlare', 'Google Tag Manager', 'MaxCDN']"
,,,,,,http://dhl.com,,,0,DHL Aviation,,,,,,Careers at DHL: There are so many job opportunities at DHL. Apply now for a job at the global logistics company ✓ Frontline ✓ Office ✓ Students & Graduates,,,active,,,"['F5 BIG-IP', 'Google Tag Manager']"
,,,,,,http://4frontmfg.com,,,0,4 Front Manufacturing,United States,,,,,"Plastic Products Co provides custom thermoplastic, metal, & ceramic injection molding for every market. Contact us to get started on your project.",-111.90251,33.40866,active,,,"['Google Tag Manager', 'WordPress']"
,,,,,,http://h-mv.com,,,0,HMV Ingenieros,Colombia,Oil & Energy,200M - 1B,"1,000 - 5,000",1960,,,,active,,,[]
,,,,,,http://michaels.com,,,1144,Michaels Companies Inc,United States,Retail,> 1B,"1,000 - 5,000",2013,"The Michaels Companies, Inc. (Michaels) is an arts and crafts specialty retailer in North America. The Company's segments include Michaels-U.S., Michaels-Canada, Aaron Brothers, Pat Catan's and Darice. As of January 28, 2017, the Company operated 1, 223 Michaels retail stores in 49 states and Canada, with approximately 18, 000 average square feet of selling space per store. It operated 109 Aaron Brothers stores in nine states, with approximately 5, 500 average square feet of selling space and 35 Pat Catan's stores in five states, with approximately 32, 000 average square feet of selling space, as of January 28, 2017. The Company also operates an international wholesale business under the Darice brand name. The Company's stores purchase custom frames, framing supplies and mats from its framing operation and subsidiary, Artistree, Inc. (Artistree), which consists of a manufacturing facility and four regional processing centers.",-96.9895,32.915573,active,5070000000,4000,"['Amazon Cloudfront', 'CloudFlare', 'Crazy Egg', 'Demandware', 'Google Analytics', 'Google Tag Manager', 'MaxCDN', 'Salesforce force.com', 'Salesforce Live Agent', 'Salesforce salesforce.com', 'WordPress']"
,,,,,,http://paybox.com,,,0,Paybox Services S.A.S.,France,Computer Software,10M - 50M,50 - 200,1999,A QUI S'ADRESSE PAYBOX Plateforme de paiement cross-canal Paybox traite à ce jour les flux de plus de 31 000 marchands et 120 millions de transactions par,,,active,,,['Google Tag Manager']
,,,,,,http://alliancehvac.ca,,,1,Alliance Energy Source,Canada,Construction,,,2011,"Alliance Energy Souce Is A Single Source For All Your HVAC Needs ,Lennox (Furnace,Heating,Cooling) in Markham,Richmond hill,maple,Ajax,Oshawa,Pickering...",-79.351616,43.823165,active,,,"['Google Analytics', 'Google Tag Manager', 'WooCommerce', 'WordPress']"
,,,,,,http://annual.asaecenter.org,,,0,AMERICAN SOCIETY OF ASSOCIATION EXECUTIVES,United States,Nonprofit Organization Management,10M - 50M,50 - 200,1957,Join us for the 2022 ASAE Annual Meeting,-77.03599,38.901352,active,30894525,133,"['CloudFlare', 'Google Analytics', 'Google Tag Manager', 'LiveChatInc']"
,,,,,,http://ahnlab.com,,,1,AhnLab US,United States,Computer & Network Security,1M - 10M,10 - 50,,"AhnLab creates agile, integrated Internet security solutions for consumers and businesses, ranging in size from SMBs to enterprise organizations.   AhnLab is a global leader in security research and product development delivers comprehensive protection for networks, transactions, and essential services. By combining cloud analysis with endpoint and server resources, AhnLab generates best-of-breed breach detection and threat prevention that scales easily for large and high-speed networks. This multi-dimensional approach combines with exceptional service to create truly global protection against attacks that evade traditional security defenses.  
Learn more today by contacting your AhnLab partner or local AhnLab sales representative, visit www.ahnlab.com",,,active,,,['Zendesk']
,,,,,,http://vipmobile.rs,,,0,Vip mobile d.o.o.,Serbia,Telecommunications,100M - 200M,"500 - 1,000",2007,Pridruži se A1 mreži koja najbrže raste i uživaj u najboljem korisničkom iskustvu. Biraj postpaid pakete ili A1 prepaid. Poruči novi telefon i dodatnu opremu.,,,active,,,"['Google Tag Manager', 'KISSmetrics']"
,,,,,,http://moyermitchell.com,,,0,"Moyer Mitchell Company, Inc.",United States,,0 - 1M,1 - 10,1933,,-75.00883,39.84671,active,,4,['Incapsula']
,,,,,,http://amazon.com,,,0,AmazonLocal LLC,United States,Computer Software,,,2010,,-122.33714,47.622227,active,,,[]
,,,,,,http://yahoo.com,,,0,YAHOO! HONG KONG LIMITED,Hong Kong,Computer Software,,,1999,,,,active,,,['comScore']
,,,,,,http://ess-a-bagel.com,,,3,"ESS-A-BAGEL, INC.",United States,Restaurants,1M - 10M,10 - 50,1992,Bustling cafe serving up bagels (with very large toppings selections) & made-to-order sandwiches.,-74.0082,40.711887,active,,,"['Amazon Cloudfront', 'Google Analytics', 'Google Tag Manager', 'WordPress']"
,,,,,,http://sltdesigngroup.com,,,0,SLT DESIGN GROUP LLC,United States,Design,0 - 1M,1 - 10,2012,"SLT Design Group is an office furniture installation company in Sacramento. We offer commercial office design & space planning, office furniture installation, commercial delivery service, commercial moving service, commercial storage service & asset management. Contact us if you need professional commercial movers!",-121.48137,38.651066,active,,,['Amazon Cloudfront']
,,,,,,http://europe.beyerdynamic.com,,,0,beyerdynamic GmbH & Co. KG,Germany,Electrical/Electronic Manufacturing,10M - 50M,200 - 500,1924,Conference and Recording Software,,,active,,,"['Amazon Cloudfront', 'Braintree', 'Google Analytics', 'Google Tag Manager', 'NewRelic', 'Zendesk']"
,,,,,,http://adaxatech.com,,,0,Adaxa Technologies,United States,Information Technology and Services,10M - 50M,50 - 200,,"MCNA is a premier dental benefits administrator that provides exceptional service to state agencies and managed care organizations for Medicaid, CHIP, and Medicare members.",,,active,,,['Google Analytics']
,,,,,,http://techdata.com,,,0,Tech Data Computer Service (HK) Ltd,Hong Kong,,,,,"Tech Data Computer Service is a premier IT solution provider that specializes in systems infrastructure, software solutions and professional services. The company was founded in since 1982 and became part of Tech Data Corporation (Nasdaq: TECD) via acquisition in 2017. Tech Data Computer Service aims to transform technology into business solutions for customers around the world. As the winner of multiple awards and accreditations from the industry, the company proactively invest in the market and next generation technologies including cloud, mobility, big data and analytics, and the Internet of Things, along with converged infrastructure, security, storage, networking, service, software and hardware. Working in partnership with industry-leading technology suppliers, Tech Data Computer Service accelerates customers’ success through extensive technical knowledge, global scale, and comprehensive product and service portfolios. The company follow industry best practices to ensure best-in-class service to customers across various industries, include banking and financial services, casino and resort, IT, logistics, manufacturing and distribution, government and public services.",114.2081677,22.3198569,active,,,"['Google Tag Manager', 'Incapsula', 'WordPress']"
,,,,,,,,,0,Tilton Corporation,United States,Construction,1M - 10M,10 - 50,1911,,-84.099045,40.733986,active,,,[]
,,,,,,,,,0,"Snow Time, Inc.",United States,Recreational Facilities and Services,50M - 100M,200 - 500,1964,,-76.63425,39.98914,active,,375,[]
,,,,,,http://arrowheadgolfnaples.com,,,0,ArrowHead Golf Course,United States,Recreational Facilities and Services,1M - 10M,10 - 50,1998,"ArrowHead Golf Club is one of the favorite golf courses to play in and around Naples, FL. ArrowHead is a full service golf facility offering a fully stocked golf pro shop, PGA professional staff, leagues, outings, tournaments, banquets and individual and group instruction.",-81.71162,26.265762,active,,,['Google Tag Manager']
,,,,,,http://bluestarelectric.com,,,0,"BLUE STAR ELECTRIC, INC.",United States,Construction,1M - 10M,10 - 50,1985,,-122.365005,47.63512,active,,,[]
,,,,,,http://gma.ru,,,0,Admiral Makarov State Maritime Academy (AMSMA),Russian Federation,Higher Education,0 - 1M,1 - 10,,"ГУМРФ им.адм. С.О. Макарова – университет, история которого начинается в 1809 году, предоставляющий современное образование в области эксплуатации водного транспорта, технологий судостроения, математического моделирования и информационной безопасности, экономики и управления",,,active,,,"['Google Analytics', 'Google Tag Manager']"
,,,,,,http://aafederation.org,,,0,ASIAN AMERICAN FEDERATION INC,United States,Nonprofit Organization Management,1M - 10M,1 - 10,1989,"The Asian American Federation's mission is to raise the influence and well-being of the pan-Asian American community through research, policy advocacy, public awareness, and organizational development. AAF strengthens the capacity of community-based social services by supporting nearly 60 member agencies in the fields of health & human services, economic development, civic participation, and social justice – all of which serve the diverse Asian American populations in New York City.",-74.00677,40.704704,active,1965169,10,"['Google Tag Manager', 'Varnish', 'WooCommerce', 'WordPress']"
,,,,,,,,,0,Quantum Nutrition Centers,United States,,,,,,,,active,,,[]
,,,,,,http://seesaw.me,,,0,SEESAW LEARNING INC,United States,Information Services,10M - 50M,50 - 200,2013,"Our mission is to create an environment where students are inspired to be their best.

Seesaw is a learning platform that brings educators, students, and families together to deepen student learning. Teachers design and facilitate powerful learning experiences, students create, reflect, collaborate, and make their learning visible, and families actively support and celebrate student learning. Seesaw is used by over 10 million teachers, students, and family members every month across more than 75% of schools in the U.S. and over 150 countries worldwide.",-122.4023,37.790592,active,,118,"['Google Analytics', 'Google Tag Manager', 'Marketo']"
,,,,,,http://jinyoungfood.com,,,0,"Jinyoung Foods Co., Ltd.","Korea, Republic of",Food Production,,,1986,누구나 쉽게 무료로 만들수 있는 모바일 홈페이지,,,active,,,"['Amazon Cloudfront', 'Google Tag Manager']"
,,,,,,,,,0,Aurelius Hospital Nilai,Malaysia,Hospital & Health Care,1M - 10M,10 - 50,1999,"Established in 1999, Aurelius Hospital Nilai was Malaysia’s first private specialist centre with two core areas of focus: clinical research and cancer treatment using Varian’s Trilogy System for precision radiotherapy treatment. It was formerly known as NCI Cancer Hospital following its acquisition by TH Group and was renamed Nilai Medical Centre in 2012 in line with its expansion as a full-fledged multi-disciplinary private medical hospital, to cater to the needs of the Nilai community and surrounding areas.

Since joining the Aurelius Healthcare family in 2021, Nilai Medical Centre has been rebranded to Aurelius Hospital Nilai. Incorporated in 2019, Aurelius Healthcare specialises in primary, tertiary, and quaternary healthcare management and services. Proudly founded in Malaysia through global healthcare management experience, our readiness to offer customised and world-class hospital management for new facilities or modernising established healthcare assets is made possible through our extensive network of in-house industry experts. Aurelius Healthcare’s tertiary hospitals have all the medical and surgical specialities that meet the full spectrum of healthcare needs of local and international patients.

The team at Aurelius Hospital Nilai is committed to delivering exceptional, patient-centric care in alignment with the standard that can be expected from Aurelius Healthcare name. Our collective aim is to create a warm, personal and caring environment to ensure the best possible care for patients and their loved ones.",,,active,,,[]
,,,,,,http://pinerest.org,,,18,Pine Rest Christian Mental Health Services,United States,Hospital & Health Care,100M - 200M,"1,000 - 5,000",1910,"Pine Rest offers a full continuum of behavioral health services and is the third largest non-profit behavioral health system in the United States. Our comprehensive behavioral health center located in Grand Rapids, Michigan offers psychiatric urgent care, outpatient, inpatient, partial hospitalization (day programs), assessment and testing, residential, addiction treatment and specialty services such as crisis response, employee assistance programs, forensic psychiatry and psychology, neuromodulation and more. 

The outpatient network includes 19 offices including teletherapy in Michigan and Iowa, providing individualized and group therapy for people of all ages and all levels of need. 

Our educational programming includes psychiatry residency and fellowships in child & adolescent, addiction and geriatric psychiatry, PA training, psychology internships, rotations for medical learners and a clinical pastoral education program. 

Pine Rest is an associate member of the National Network of Depression Centers. Some of our recent research collaborations have included partnerships with Duke University, Fuller Theological Seminary, Mayo Clinic, McLean Hospital, Michigan State University, National Institutes of Health, University of Chicago, University of Michigan and Van Andel Research Institute.

IF YOU ARE IN CRISIS, PLEASE CALL 911 OR 800-678-5500 FOR IMMEDIATE ASSISTANCE.",-85.65621,42.840725,active,140758656,2414,"['Google Tag Manager', 'Gravatar', 'WordPress']"
,,,,,,http://huons.com,,,0,HUONS CO LTD,"Korea, Republic of",Pharmaceuticals,100M - 200M,,1965,,,,active,160200000,,['CloudFlare']
,,,,,,,,,0,OXEA S.à r.l.,Luxembourg,Chemicals,200M - 1B,"1,000 - 5,000",,,,,active,,1400,[]
,,,,,,http://amazon.es,,,0,buyVIP SL,Spain,,100M - 200M,"500 - 1,000",2006,"Descubre y compra online: electrónica, moda, hogar, libros, deporte y mucho más a precios bajos en Amazon.es. Envío gratis con Amazon Prime.",,,active,,,['Amazon Cloudfront']
,,,,,,http://hafele.ca,,,0,Häfele Canada Inc.,Canada,Building Materials,,,1983,"A global market leader in providing hardware solutions and innovation to the furniture, kitchen cabinet, architectural millwork and hospitality industries.

The Häfele perspective:  At a time when living space continues to increase in value and its availability diminishes around the world, hardware technology is becoming an increasingly important component for functional furniture, furnishings, rooms and buildings because it’s the hardware that gives the objects perfect functionality.  Quality, function and design of fittings have a direct influence on the value of furniture for the consumer, making the hardware industry an important generator for trends and ideas in the architectural and furniture sectors.  We assist investors, developers, architects, designers, planners and consumers with this message.

Häfele is a family run company with a long and rich history that began in 1923. Since that time the guiding principle has always been strong roots in innovative and entrepreneurial spirit. Today customers from 150 countries rely on the experience and performance provided by Häfele's 8000 employees. Our goal is simple:  Leadership in the world of hardware.

We focus on solving problems – in many instances problems you didn’t even know you had – and bringing our creativity and ingenuity to a very specialized group of businesses and customers.",,,active,,,['Google Tag Manager']
,,,,,,http://goindigo.in,,,0,Interglobe Aviation Ltd,India,Airlines/Aviation,> 1B,"> 10,000",2004,"Interglobe Aviation Limited is engaged in the provision of passenger services. The Company is engaged in the business of providing domestic and international scheduled air transport services under the name of IndiGo. The Company's segments include Domestic, which provides air transportation within India, and International, which provides air transportation outside India. The Company operates on a low-cost carrier (LCC) business model. The Company has a fleet size of approximately 110 aircrafts. The Company offers flights to over 30 cities in India and approximately five cities internationally, including Bangkok, Dubai, Kathmandu, Muscat and Singapore.",,,active,4629594034,23530,"['Akamai', 'Amazon Cloudfront', 'Google DoubleClick']"
,,,,,,,,,0,Aviapartner Belgium NV,Belgium,Transportation/Trucking/Railroad,10M - 50M,200 - 500,1949,"Aviapartner is one of the leading independent providers of ground handling services across 37 airports in 6 European countries. With a workforce of more than 6,000 motivated employees, we annually serve the needs of more than 30 million passengers. Aviapartner offers almost 70 years of flight-related service experience to over 400 passenger and cargo airlines, ranging from check-in and boarding assistance to preparation of flight documentation and ground to air communication. With ramp handling for 300,000 aircraft movements and cargo services of around 1 million tons of cargo each year, Aviapartner is proud of its IT and logistic capabilities to deliver unparalleled service quality and flexibility according to the needs of each airline. This is supported by our numerous quality certifications and airline awards. Aviapartner stands for Commitment and flexibility, strong team spirit, dialogue and mutual respect; that is the engine of our company. Therefore education, job opportunities and respect for each other’s work are important values within the company. This is the attitude we have in mind when serving our customers. http://www.aviapartner.aero/",,,active,,224,[]
,,,,,,http://wikia.com,,,5,"Wikia, Inc.",United States,Computer Software,50M - 100M,200 - 500,2004,"Fandom is a global entertainment media brand powered by fan passion. The fan-trusted source in entertainment, Fandom provides a home to explore, contribute to, and celebrate the world of pop culture. Whether looking for in-depth information on favorite fandoms or what’s buzzing in entertainment, Fandom has your pop culture curiosities covered through fan-expert knowledge and carefully curated and fun, original multi-platform content. 
 
Fandom has a global audience of 300 million monthly uniques and encompasses over 250,000 fan communities. We currently feature more than 55 million pages of content, inclusive of video.
 
Download the new Fandom app for iOS and Android for a personalized entertainment experience and follow @getfandom  and @life_at_fandom on all social media platforms. For more information, visit www.fandom.com.",-122.39582,37.781296,active,,323,"['CloudFlare', 'Google Analytics', 'Google Tag Manager', 'Optimizely', 'quantcast', 'WordPress', 'Zendesk']"
,,,,,,http://spbgasu.ru,,,0,Saint-Petersburg State University of Architecture and Civil Engineering,Russian Federation,Higher Education,200M - 1B,"1,000 - 5,000",1832,"Федеральное государственное бюджетное образовательное учреждение высшего профессионального образования «Санкт-Петербургский государственный архитектурно-строительный университет» (СПбГАСУ) сегодня - крупный учебный и научный центр, единственный в Северо-Западном федеральном округе Российской Федерации вуз, осуществляющий комплексную подготовку специалистов в области строительства, архитектуры, транспорта и инженерно-экологических систем. СПбГАСУ имеет давние профессиональные и педагогические традиции и постоянно обновляет технологии обучения, тематику и методику научных исследований.",,,active,,,"['Drupal', 'Google Tag Manager']"
,,,,,,http://thoughtco.com,,,0,ThoughtCo,United States,,0 - 1M,1 - 10,,"From chemistry to computer programming, arts to World War II, ThoughtCo.com provides guides, tips, and resources to help you understand more about the world around us.",,,active,,,"['Google DoubleClick', 'Google Tag Manager']"
,,,,,,,,,0,HiCo GmbH,Austria,,,,,,,,active,,,[]
,,,,,,,,,0,"Baolixin New Energy Development Co., Ltd.",China,,,,2015,,,,active,,,[]
,,,,,,http://dhl.com,,,0,DHL Aviation,,,,,,Careers at DHL: There are so many job opportunities at DHL. Apply now for a job at the global logistics company ✓ Frontline ✓ Office ✓ Students & Graduates,,,active,,,"['F5 BIG-IP', 'Google Tag Manager']"
,,,,,,http://skyline.com,,,2,"Skyline Displays, Inc.",United States,Computer Hardware,100M - 200M,"500 - 1,000",1980,"Trade show displays, trade show exhibits, trade show booths, and banner stands from Skyline Exhibits, the leading designer and builder of trade show displays.",-93.14332,44.833973,active,,638,"['Google Analytics', 'Gravatar', 'NewRelic', 'Pardot', 'Wistia', 'WordPress']"
,,,,,,,,,0,dwpIAustralia,Australia,Architecture & Planning,10M - 50M,200 - 500,1958,,,,active,,,[]
,,,,,,,,,0,ESC Systems Sound And Life Safety,United States,Security and Investigations,1M - 10M,10 - 50,,,-92.22424,46.74629,active,,,[]
,,,,,,http://americanmicroinc.com,,,0,"American Micro Industries, Inc.",United States,Electrical/Electronic Manufacturing,1M - 10M,10 - 50,1995,"American Micro Industries, Inc. | 67 followers on LinkedIn. American Micro Industries and its Custom Components Division are the leading manufacturers of made-to-order parts and components for the aerospace, defense, electronics, marine, military and technology industries.

Proudly a veteran-owned and operated company since 1995, our expert team has one goal: providing complete customer satisfaction. We are customer oriented, quality conscious and we strive for on time delivery.",-77.644485,39.94742,active,,16,"['Crazy Egg', 'Google Analytics', 'Google Tag Manager', 'WooCommerce', 'WordPress']"
,,,,,,http://martinguitar.com,,,0,"C. F. Martin & Co., Inc.",United States,Manufacturing,50M - 100M,"500 - 1,000",1833,Martin Guitar has created the finest guitars & strings in the world for over 180 years. They're the choice from professionals to beginner guitar players.,,,active,,540,"['Demandware', 'Google Tag Manager', 'Salesforce force.com', 'Salesforce Live Agent', 'Salesforce salesforce.com']"
,,,,,,http://hollistersafeandlock.com,,,0,"HOLLISTER SAFE & LOCK, INC.",United States,Security and Investigations,0 - 1M,1 - 10,2006,Full locksmith services in Hollister. Mobile services available.,-121.401924,36.8575,active,,,"['WooCommerce', 'WordPress']"
,,,,,,http://energy-equipment.com,,,0,Energy Equipment Corporation,United States,,1M - 10M,,1985,,-95.458755,29.842333,active,3000000,,[]
,,,,,,http://lincolnberg.com,,,1,Lincolnberg Homes Inc.,Canada,Construction,1M - 10M,10 - 50,1978,"Looking for a home builder in Edmonton? Explore our show homes and quick possessions including duplexes, single-family homes, and more.",,,active,,,['CloudFlare']
,,,,,,http://hedrickfireprotection.com,,,0,HEDRICK FIRE PROTECTION INC.,United States,Construction,0 - 1M,1 - 10,2014,"HEDRICK FIRE PROTECTION is a company based out of 13309 CENTRAL AVENUE, CHINO, California, United States.",-117.68924,34.011578,active,,,['Google Tag Manager']
