_id,link,last_seen,ispublished,views,deadline,company_name,content,source,branches_count,display_name,country,industry,revenue_range,employees_range,year_founded,description,longitude,latitude,company_status,revenue,employees_count,technologies_used
,,,,,,http://strandls.com,,,0,Strand Life Sciences Pvt Ltd.,India,Biotechnology,100M - 200M,"500 - 1,000",2000,"Strand Life Sciences is a Bangalore-based bioinformatics company founded in 2000 by entrepreneurs from the Indian Institute of Science. 

Strand’s mission is to support precision medicine across the entire R&D lifecycle, from the lab to the clinic to data analysis. To that end, Strand has developed tools, platforms and services that span these disciplines. 

Key achievements include 
a cutting edge NGS liquid biopsy assay for early detection of oral cancer from saliva; 
a knowledge-base for interpretation of solid tumor and heme variants with over 500 genes, 20,000 variants, 110 FDA drugs and 80,000 clinical trials; 
a CAP and NABL-accredited genomics lab that has tested ≈10,000 samples in oncology, germline cancer, and rare diseases; 
Strand NGS, a software platform for secondary and tertiary analysis of NGS data;
 StrandOmics, a HIPAA-compliant, cloud-based platform for germline and somatic variant interpretation and reporting, used to generate clinical reports on all the ≈10,000 samples tested in our labs; and 
StrandIris, a fully automated, HIPAA-compliant cloud solution for interpretation and reporting of somatic variants. 

Underpinning these achievements is a strong track record of delivery on software development, assay development and biomarker studies projects with leading US-based instrument, diagnostics, pharmaceutical and biotech companies, a customer-base spanning ≈200 academics and diagnostics companies, and ≈25,000 citations of products developed at Strand since 2005.",,,active,,,"['Google Analytics', 'Google Tag Manager', 'WordPress']"
,,,,,,http://harvestwealthservices.com.au,,,0,Harvest Wealth Services Pty Ltd,Australia,Financial Services,0 - 1M,1 - 10,2014,"No matter what stage of life you are in, we are here to help. Harvest Wealth is passionate about 'making a difference' so you can live your best possible life.

Financial planning is not just about investments and superannuation. It's for anyone who wants to take charge of their financial situation, whether you are just starting out or living your retirement, we are here to help.

At Harvest Wealth, we work with you to define your goals and understand which strategies suit you best. We work hard to understand your current situation, your goals and to help you make your dreams a reality. Making a difference.

DISCLAIMER:
This LinkedIn page contains information that is general in nature. It does not take into account the objectives, financial situation or needs of any particular person. You need to consider you financial situation and needs before making any decisions based on this information.

WHO WE ARE:
Harvest Wealth Services Pty Ltd (ABN 30 600 988 332), trading as Harvest Wealth Services Pty Ltd is an authorised representative and credit representative of AMP Ltd, Australian Financial Services Licensee and Australian Credit Licensee.

FINANCIAL SERVICES GUIDE:
This is important, as it contains information that will help you decide whether to use any of the financial services offered by us.  You can find it on our web site, at the bottom of the page , or by clicking here->>
https://www.harvestwealthservices.com.au/fscg",,,active,,,"['Google Analytics', 'Google DoubleClick', 'Google Tag Manager']"
,,,,,,http://taya.co.il,,,0,Taya Communications Ltd.,Israel,,,,,,,,active,,,[]
,,,,,,http://useinsider.com,,,0,Insider,United Kingdom,Computer Software,50M - 100M,200 - 500,2012,"Insider's CDP connects customer data, predicts behavior with AI, and individualizes experiences across channels (CCCM). Go beyond personalization to become a purpose-led brand.",,,active,,,"['Google Analytics', 'Google DoubleClick', 'Google Tag Manager', 'Gravatar', 'HubSpot', 'WordPress']"
,,,,,,http://zergnet.com,,,0,ZergNet.com,United States,Computer Software,1M - 10M,10 - 50,,,-86.07288,40.005398,active,,,['Google Analytics']
,,,,,,http://fontys.nl,,,0,Fontys Centrum voor Ondernemerschap,Netherlands,Education Management,1M - 10M,10 - 50,,"Het Fontys Centrum voor Ondernemerschap (CvO) helpt studenten bij het ontwikkelen van een ondernemende houding, waardoor ze als ondernemer of, als ondernemende professional in loondienst toetreden in hun beroepspraktijk. 
Een ondernemende houding en ondernemend gedrag hebben niet alleen betrekking op ‘een bedrijf starten’ (de entrepreneur), maar studenten kunnen dit ook laten zien in dienst van een organisatie (als intrapreneur), ten behoeve van de maatschappij (als social entrepreneur) of om persoonlijke doelen te bereiken.

Fontys CvO richt zich met haar dienstverlening op verschillende doelgroepen, waarbij maatwerk centraal staat zoals het aanbieden van specifieke trainingen, coaching en minor onderwijs.",,,active,,12,"['F5 BIG-IP', 'Google Tag Manager']"
,,,,,,http://quikchex.in,,,0,Quikchex,India,Human Resources,1M - 10M,10 - 50,2013,"Quikchex makes it easy and affordable for Indian SMBs to pay and manage their employees. Through a single beautifully designed interface, HR Managers, Finance Managers and/or Payroll managers can process payroll, leave and reimbursements in a matter of minutes.  

Too busy to run your own payroll and compliance? No worries. A dedicated Quikchex Payroll Manager will manage all the granular legwork, including ensuring that you comply with your tax and statutory liabilities. All you need to do is send over attendance and incentive payment information.  We take care of the rest.

Try us out for free at www.quikchex.in",,,active,,,"['Google Tag Manager', 'WordPress']"
,,,,,,http://abiomed.com,,,0,ABIOMED Inc,United States,Medical Devices,200M - 1B,"1,000 - 5,000",1987,"ABIOMED, Inc. is a provider of temporary percutaneous mechanical circulatory support devices. The Company offers care to heart failure patients. The Company operates in the segment of the research, development and sale of medical devices to assist or replace the pumping function of the failing heart. The Company develops, manufactures and markets products that are designed to enable the heart to rest, heal and recover by improving blood flow to the coronary arteries and end-organs and/or temporarily performing the pumping function of the heart. The Company's product portfolio includes the Impella 2.5, Impella CP, Impella RP, Impella LD, Impella 5.0 and AB5000. The Company's products are used in the cardiac catheterization lab (cath lab), by interventional cardiologists, the electrophysiology lab, the hybrid lab and in the heart surgery suite by heart surgeons.",-70.916016,42.576073,active,841310000,1370,"['Amazon Cloudfront', 'Drupal', 'Google Tag Manager', 'Wistia']"
,,,,,,http://cipsacircuits.com,,,0,Grupo Cipsa,Spain,Computer Hardware,,,,"CIPSA CIRCUITS. Fabricación de circuitos impresos, circuitos multicapa, circuitos flexibles, fabricación de circuitos pcb y fabricación de prototipos.",,,active,,,"['Google Analytics', 'Google Tag Manager', 'WooCommerce', 'WordPress']"
,,,,,,http://hm.com,,,0,H & M Hennes & Mauritz AB,Sweden,Retail,> 1B,"> 10,000",1947,"H & M Hennes & Mauritz AB is a Sweden-based company active in the clothing industry. It operates under such brand names, as H&M, H&M Home, COS, Monki, Weekday, Cheap Monday and & Other Stories. It is engaged in the design, manufacture and marketing of clothing items and related accessories. The Company's product range comprises clothing, including underwear and sportswear, for men, women, children and teenagers, as well as cosmetic products, accessories, footwear and home textiles. The Company offers its products in a number of branded stores spread across over 40 markets. Additionally, the Company offers online and catalogue sales in Sweden, Norway, Denmark, Finland, the Netherlands, Germany, Austria and the United Kingdom, among others.",,,active,23783058804,179000,"['Akamai', 'CloudFlare', 'Fastly', 'Optimizely']"
,,,,,,,,,0,COMINTES,Canada,Wholesale,,,,"International business service centre for more than 40 years:

- 3PL and 4PL logistics provider (warehousing, pick&pack, kitting, delivery everywhere in Europe)
- Ecommerce fulfilment covering 27 countries
- Distribution of mass market products
- Market penetration and sales support
- International tax and legal compliance services
- Office space rental and virtual offices",-73.562745,45.485587,active,,,[]
,,,,,,http://vibrascreener.com,,,0,VibraScreener Inc,United States,Machinery,10M - 50M,50 - 200,2015,"VibraScreener specialize in the design and manufacture of vibratory screeners and separators. We provide technically advanced, reliable, and cost effective sieving and separation solutions that feature higher capacity, low maintenance, easy to clean and dismantle, lower noise levels and very sanitary models and technologies. 

VibraScreener customer base consists of major U.S. and international corporations. Major industries served are the food and beverage, pharmaceutical, chemical, cosmetics, ceramics, powder coating, metallurgy, plastics, aggregates, minerals and recycling industries. In addition to our standard innovative product line, we develop and design custom and specialty products to assist customers with specific or unique projects and plant requirements delivering products exactly to customer specifications. 

As leaders providers of process machinery, with customers ranging from multinational corporations to family owned processing facilities, our focus is on the continuous development of advance intelligent technologies that improve sustainability and profitability of all of our customers.",-80.86905,35.268093,active,,,"['Google Tag Manager', 'Gravatar', 'WordPress']"
,,,,,,http://coswell.biz,,,0,Coswell S.p.A.,Italy,Chemicals,10M - 50M,50 - 200,1961,"Coswell è specializzata nella produzione e commercializzazione di prodotti di largo consumo per la cura e il benessere della persona ed opera in diversi canali distributivi: GDO, Farmacia, Profumeria. 

Fondata nel 1961, Coswell vanta 60 anni di esperienza, successi e numerosi brand leader nei rispettivi mercati: Biorepair  e Blanx nella categoria Oral Care; Bionsen e Prep nella categoria Personal Care; L’Angelica nella categoria Health Food; Isomar e Lenigola nella categoria Pharma,  Gandini e Rockford nella categoria Fragranze. 

Siamo una azienda verticalmente integrata che sviluppa e produce presso i propri laboratori R&D e i propri stabilimenti oltre il 90% dei prodotti immessi sul mercato. 

Crediamo fortemente nella continua ricerca ed innovazione di prodotto e processo e nella sostenibilità ambientale e sociale di ciò che realizziamo, coniugando la creazione di valore economico e sociale.

Per Coswell ogni persona è portatrice di nuove idee, idee da realizzare insieme.",,,active,,185,"['CloudFlare', 'Google Tag Manager']"
,,,,,,http://lined-ball-valves.com,,,0,Complete Corrosion Solutions Inc.,United States,Chemicals,1M - 10M,10 - 50,2009,"Complete Corrosion Solutions Inc. has assembled the best possible products to solve your Safe Access and Corrosion issues. Our Standard offerings in, Safe Access Equipment and Corrosion Resistant Piping, Equipment and Vessels can handle your most challenging applications.

We can provide specialty products per your specifications or help you determine the best solutions for your most difficult applications.

Safe Access and Fall Protection: We offer off the shelf solutions and replacement Items, as well as a complete survey of your access and fall protection needs. From single components to complete turn-key projects.",,,active,,,[]
,,,,,,http://lidestrifoods.com,,,0,"LiDestri Foods, Inc.",United States,Food Production,200M - 1B,"1,000 - 5,000",1975,"LiDestri is a premier private label and contract manufacturer of food, beverages and spirits, supplying over 40 million cases of product each year.",-77.44798,43.10847,active,,1652,['Google Analytics']
,,,,,,http://bushnellcompany.com,,,1,Bushnell & Company,United States,Insurance,0 - 1M,1 - 10,1973,"Bushnell & Company | 54 followers on LinkedIn. Established in 1973, Bushnell & Company is a professional services Actuarial & Employee Benefits Consulting firm. We are NOT insurance agents or brokers!  Since we are an independent fee-only based firm, our income is transparent and not tied to high or undisclosed commissions, incentives, trips, etc. from the sale of insurance products.",,,active,,,"['Constant Contact', 'Google Tag Manager', 'WooCommerce', 'WordPress']"
,,,,,,http://sevillanolegal.ca,,,0,Sevillano Legal Services,Canada,Legal Services,,,,"The firm offers following practical and cost-effective solutions to clients: Traffic Violations, including MTO matters, Civil Claims under the jurisdiction of Small Claims Court, Landlord and Tenant Disputes, Employment Standards and Human Rights, Municipal By-Laws and WSIB Compensation (Workplace Safety and Insurance Board)

Services to law firms: Legal Research, Court Filing, Other Legal Services on Demand

We provide the following services while representing clients in any of the proceedings in scope of paralegals practice:
Give legal advice concerning legal interests, rights or responsibilities with respect to a proceeding;
Draft or assist with drafting documents for use in a proceeding;
Negotiate on behalf of a person who is a party to a proceeding.

All services can be provided in English, German or Russian languages.
",,,active,,,['Google Analytics']
,,,,,,http://armedia.com,,,1,Armedia,United States,Information Technology and Services,10M - 50M,,2002,"A technology firm that provides information and content management services through its expertise, services and products on platforms, including Alfresco, Drupal and EMC among others.",-84.43907,33.906635,active,32086000,,"['Google Analytics', 'Google Tag Manager', 'WordPress']"
,,,,,,http://alibabagroup.com,,,0,Alibaba Group Holding Ltd,China,Internet,> 1B,"> 10,000",1999,"Alibaba Group Holding Limited is a Chinese e-commerce company that provides consumer-to-consumer, business-to-consumer and business-to-business sales services via web portals. It also provides electronic payment services, a shopping search engine and data-centric cloud computing services. The group began in 1999 when Jack Ma founded the website Alibaba.com, a business-to-business portal to connect Chinese manufacturers with overseas buyers. In 2012, two of Alibaba's portals handled 1.1 trillion yuan ($170 billion) in sales.[3] Suppliers from other countries are supported (with more stringent checks than for Chinese companies),[4] but the company primarily operates in the People's Republic of China (PRC). At closing time on the date of its initial public offering (IPO), 19 September 2014, Alibaba's market value was US$231 billion.[5] However, the stock has traded down and market cap was about $212 billion at the end of December 2015.",,,active,11815947625,34985,"['CloudFlare', 'Google Tag Manager', 'WordPress']"
,,,,,,,,,1,KFW Engineers & Surveying,United States,Civil Engineering,10M - 50M,50 - 200,2006,"KFW is a locally-headquartered company established in September of 2006 with a mission to provide the highest quality engineering and customer service in South Texas. KFW established KFW Surveying in 2008, fulfilling the Owners’ vision to become a full service Civil Engineering consulting firm. Our full-time staff consists of over 150 employees, including Texas Professional Engineers, Engineers-in-Training, Professional Geologist, GIS Technicians, Registered Professional Land Surveyors, and full-time field crews. We have five company executives who together provide matchless expertise:  Managing Partners, Steven Krauskopf, P.E. and George Weron, P.E.; and Partners, Blaine Lopez, P.E., Billy Classen P.E., and Teresa Seidel, R.P.L.S.
2018, 2019, & 2020 Best Places to Work.",,,active,,,[]
,,,,,,http://dart.com,,,1,"Dart Communications, Inc.",United States,Computer Software,1M - 10M,10 - 50,1994,"Dart Communications, located in upstate New York, has been designing and developing Internet communication components since 1994. More than a decade later, three lines of products, PowerTCP and PowerSNMP for ActiveX and .NET, and PowerWEB for ASP.NET, are well known throughout the world; becoming a successful part of projects for small businesses, consultants, and Fortune 500 companies.",-75.4262,43.219513,active,,,"['Google Tag Manager', 'MaxCDN', 'Shopify']"
,,,,,,http://sberbank.ru,,,0,Sberbank,Russian Federation,Banking,> 1B,"> 10,000",1841,"Sberbank Russia OJSC provides commercial banking and financial services. It engages in corporate and retail banking activities, such as deposit taking and commercial lending in freely convertible currencies, support of clients' export/import transactions, foreign exchange, securities trading, bank insurance and brokerage, and trading in derivative financial instruments. It operates through the following business segments: Moscow; Central and Northern Regions of European Part of Russia; Volga Region and South of European Part of Russia; Ural, Siberia and Far East of Russia; and Other Countries. The company was founded in 1841 and is headquartered in Moscow, Russia.",,,active,,293752,"['CloudFlare', 'Google Analytics', 'Google Tag Manager']"
,,,,,,http://ainavo.co.jp,,,0,Ainavo Holdings Co Ltd,Japan,,200M - 1B,"500 - 1,000",1955,"AINAVO HOLDINGS Co., Ltd., is a Japan-based company involved in the large-sized property business and the detached house business. The Company operates in two business segments. The Detached House segment is engaged in the sale and construction of various tile products such as interior and exterior tiles, floor tiles, exteriors and other related products, and housing related products such as bathtubs, water heaters, system kitchens, sanitary equipment, solar power generation systems and other products. The Large-sized Property segment is engaged in the interior tile, exterior tile and floor tile construction works, the housing equipment construction works such as unit baths, system kitchens, bathtubs and others, the large ceramic tile works made of stones and dry methods, and the air conditioning and sanitary equipment works.",,,active,649354659,804,['Google Analytics']
,,,,,,,,,0,"Instituto Mexicano de Investigación Clínica, S.A. de C.V.",Mexico,,,,1999,,,,active,,,[]
,,,,,,http://mebank.ir,,,0,Mehr Eqtesad Bank,"Iran, Islamic Republic of",Banking,,,,,,,active,,,['Google DoubleClick']
,,,,,,http://avereenergy.com,,,0,Avere Energy Inc,Canada,Oil & Energy,0 - 1M,1 - 10,,,,,active,,,[]
,,,,,,http://balearia.com,,,0,"BALEÀRIA EUROLINEAS MARITIMAS, S.A.",Spain,,,,1998,Viaja en Ferrys Baleària para disfrutar de tus mejores destinos en barco. Grandes ofertas y descuentos en todas nuestras rutas. ¡Reserva ya tu viaje en ferry con nosotros!,,,active,,,"['AB Tasty', 'Google Tag Manager']"
,,,,,,http://beximco.org,,,0,BEXIMCO Group,Bangladesh,Business Supplies and Equipment,,,1965,"The BEXIMCO Group is the largest private-sector group in Bangladesh. BEXIMCO was founded in the 1970s by two brothers – Ahmed Sohail Fasihur Rahman and Salman Fazlur Rahman. Since the early days, the Group has evolved from being primarily a commodities trading company to a leading, diversified group with a presence in industry sectors that account for nearly 75% of Bangladesh's GDP. BEXIMCO's corporate mission is ""Taking Bangladesh to the world"".

As BEXIMCO has grown over the years, the flagship platform now has operations and investments across a wide range of industries including textiles, pharmaceuticals, PPE, ceramics, real estate development, construction, trading, marine food, information and communication technologies, media, DTH, financial services, and energy. The Group sells its products and services in the domestic Bangladesh market as well as international markets. BEXIMCO is the largest employer in the private sector in Bangladesh and employs over 70,000 people worldwide.

The BEXIMCO name has now become one of the most recognizable brand names in Bangladesh. It is synonymous with innovation, trust, and quality. The Group consists of four publicly traded and seventeen privately held companies. The publicly traded companies are Bangladesh Export Import Company Limited, Beximco Pharmaceuticals Limited, Shinepukur Ceramics Limited, and Beximco Synthetics Limited. The total revenue of the group stands in excess of a Billion US Dollars per year.

In recent times BEXIMCO has launched its newest Vertical, the BEXIMCO PPE Division which is responsible for producing the highest grade of internationally certified PPE products for medical use.

BEXIMCO intends to leverage its market position and global scale, further diversify operations into highly profitable sectors, capitalize on the domestic growth opportunity and selectively pursue international opportunities going forward.",,,active,,,"['CloudFlare', 'Google Tag Manager']"
,,,,,,http://spokanecertifiedaccountant.com,,,0,Johnson & Associates CPAs,United States,Accounting,0 - 1M,1 - 10,,,-117.41271,47.66614,active,,,[]
,,,,,,,,,0,Hayes Lemmerz Belgie B.V.B.A,Belgium,Automotive,,,,,,,active,,,[]
,,,,,,http://arabiaweather.com,,,0,ArabiaWeather Inc.,"Virgin Islands, British",,,,,طقس العرب اول واكبر موقع عربي يقدم معلومات عن توقعات حالة الطقس والمناخ والاحوال الجوية واخبار الطقس والنشرة الجوية لمنطقة واشنطن و الولايات المتحدة و مدن الوطن العربي والعالم,,,active,,,"['Google Analytics', 'Google DoubleClick']"
,,,,,,http://forconstructionpros.com,,,0,Pavement Maintenance & Reconstruction Magazine,United States,Local Business,1M - 10M,10 - 50,,"Articles, news, products, blogs and videos from For Construction Pros.",-88.85101,42.909405,active,,,"['Amazon Cloudfront', 'CloudFlare', 'Google Analytics', 'Google DoubleClick', 'Google Tag Manager', 'outbrain']"
,,,,,,http://peelschools.org,,,33,PEEL DISTRICT SCHOOL BOARD,Canada,Primary/Secondary Education,> 1B,"> 10,000",1971,,-79.721399,43.593383,active,,,"['CloudFlare', 'Google Tag Manager']"
,,,,,,http://bltllc.com,,,1,"Better Life Technology, LLC",United States,Construction,10M - 50M,50 - 200,1998,"Better Life Technology is the leading manufacturer of roll out vinyl solutions. Durable, designable, and  high-quality,  made from 100% solid vinyl solutions. The line has continued to expand, now including AquaTread Marine Flooring, Transit, GrowFloor, and most recently, BILD Print Media.

Better Life Technology, LLC was founded in 1998 by Don & Brett Sneed in Lenexa, KS, when Brett identified a need for an easy to install and maintain, durable garage floor protector. He worked with Don to develop G-Floor, which is made of thick, solid vinyl and rolls out for easy installation. They positioned G-Floor against traditional epoxy floors, which can take up to 16 days to fully install and are prone to cracking, staining and peeling if not installed properly. Because it is compatible with alkais and acids in concrete, G-Floor protects garage floors without breaking down the subfloor.

Since 2004, Better Life Technology, LLC has added new color options, textures and dimensions, and has been featured in many home improvement magazines and television shows. G-Floor can also be found in more than 1,200 retail stores nationwide, as well as via a variety of online distributors.",-94.77236,38.95223,active,,,"['Varnish', 'WooCommerce', 'WordPress']"
,,,,,,http://business-sa.com,,,0,Business SA,Australia,Nonprofit Organization Management,10M - 50M,50 - 200,1839,"Your success is our business.

Business SA exists to create a stronger South Australia by supporting the business community and helping businesses to grow since the Adelaide Chamber of Commerce was established in 1839.

We back the job makers and risk takers. We back the creators, the innovators and the entrepreneurs. We back the people who chase their dreams, follow their passions and put it on the line.

As the independent, representative voice of employers and business owners in South Australia, we want to create the best possible environment for them to succeed. Through providing business with knowledge, advice, connection and advocacy. We have been doing this for over 180 years, without fear or favour.
We are constantly seeking to answer that enduring question: ‘what’s next for business in South Australia?’",,,active,,,"['CloudFlare', 'Google Tag Manager']"
,,,,,,http://illinois.gov,,,13,State of Illinois,United States,Government Administration,100M - 200M,,2022,"Find places to go, things to see. Search through all the different services offered by the various Illinois agencies.",-87.64622,41.949043,active,189415376,,"['Google Analytics', 'Google DoubleClick', 'Google Tag Manager', 'MaxCDN']"
,,,,,,http://elevenfinancial.com,,,0,Eleven Financial Research,Brazil,Financial Services,1M - 10M,10 - 50,2015,"Founded in 2015, Eleven is an IRP (Independent Research Provider), with a mission to assist investors around the world to make the best investment decisions. By means of proprietary analysis, we cover the all Brazilian investment assets classes.

Our team is guided by technical precision, discipline, and responsibility, with independent analysis lying at the core of our DNA.

Eleven will provide full coverage for selected stocks chosen through a stock picking process that will deliver solid Value Investing options.",,,active,,,['Google Tag Manager']
,,,,,,http://huanqiu.com,,,0,"Foshan JINHUANQIU Ceramic Co., ltd.",China,,10M - 50M,50 - 200,,"Foshan JINHUANQIU Ceramic Co., ltd., Foshan",,,active,,,[]
