_id,link,last_seen,ispublished,views,deadline,company_name,content,source,branches_count,display_name,country,industry,revenue_range,employees_range,year_founded,description,longitude,latitude,company_status,revenue,employees_count,technologies_used
,,,,,,http://lgfcu.org,,,103,LOCAL GOVERNMENT FEDERAL CREDIT UNION,United States,Credit Unions,1M - 10M,,1983,"Local Government Federal Credit Union (LGFCU) is a not-for-profit, member-owned financial cooperative established to serve the financial needs of local government employees, elected and appointed officials, volunteers and their families. Our full range of financial services are created specifically to improve the lives of our members. Federally Insured by NCUA. Equal Housing Opportunity.

We make financial services affordable and accessible for more than 330,000 members across North Carolina. Helping our individual members improve financially helps the North Carolina communities they serve become stronger.

View our full Comment Policy at www.lgfcu.org/commentpolicy",-78.64369,35.7827,active,9000000,,"['Amazon Cloudfront', 'CloudFlare', 'Drupal', 'F5 BIG-IP', 'Google Analytics', 'Google DoubleClick', 'Google Tag Manager', 'Marketo']"
,,,,,,http://dxengineering.com,,,0,DX Engineering,United States,Consumer Goods,10M - 50M,50 - 200,,"Get fast, Free Standard Shipping on orders over $99 from DX Engineering -- no shipping, handling, or rural fees! Exclusions apply.",-81.41079,41.079376,active,,,['Incapsula']
,,,,,,http://guikar.com,,,0,CARNICAS GUIKAR SL,Spain,,1M - 10M,10 - 50,1988,Cárnicas Guikar Carne de Vaca de calidad online | Carnes para recordar | En tu casa en 24/48 hrs | 40 años ofreciendo la mejor carne de vaca,,,active,,,"['Google Tag Manager', 'WooCommerce', 'WordPress']"
,,,,,,http://s-s.mx,,,0,"Santamarina y Steta, S.C.",Mexico,Law Practice,,,1947,Expand and consolidate your business in Mexico with innovative solutions and comprehensive legal advice.,,,active,,,"['Google Tag Manager', 'Sukuri/Cloudproxy', 'WooCommerce', 'WordPress']"
,,,,,,http://baxterofcalifornia.com,,,1,"BAXTER OF CALIFORNIA, LLC",United States,Apparel & Fashion,1M - 10M,10 - 50,2020,"Your Source For Award-Winning Hair Care, Skincare, Shaving, & More. View All Products. Discover Natural, Paraben-Free Hair, Shave And Skin Products. Great Deals Inside.",-77.1059,39.05103,active,,19,"['Amazon Cloudfront', 'Shopify']"
,,,,,,http://realix.in,,,0,Realix Industries Pvt.Ltd.,India,Transportation/Trucking/Railroad,,,2001,"Realix Industries has been investing continuously in various  R & D initiatives based on its expertise in the field of compliance management for road safety systems for more than ten years. Our endeavor has always been in deploying technology driven solutions for  making roads safe for users.

The  revolutionary  ""mVaahan"" App. developed by our team is a huge success and has opened doors to a new level of results in compliance management for  RTO and RTA authorities all over India in managing their fitness related activities online.

The accuracy that comes with QR code based system prevents usage of low quality and unapproved spurious material on vehicles during fitness.

The unique solution for ensuring School Bus fleet owners follow RTA norms helps keep children travelling to school more safer.

We have been instrumental in setting up command control centres for many RTO's  by providing back end system to get VTS event alarms back to police control rooms and RTO offices. 

The combination of years of on field experience and usage of technology to augment our efforts in providing the right solutions is what differentiates Realix in the field of Road Safety Systems for State Public Transport Departments.

Contrary to common belief we feel innovation is not limited to a moment of solitary genius. It's not a revolutionary idea that pops up when you're alone instead it is a consistent process of formulating new proposals while being in direct contact with what is intended to innovate. And the most critical part is to get your innovation accepted amidst the chaos of disruption it brings to the same market. It is only then a business can continue to exist and bring long term results.

We believe in fostering open management styles by motivating our team to utilize their on field problems and failures for identifying opportunities for improvements. 

Visit our website for more details....",,,active,,,"['CloudFlare', 'Google Analytics']"
,,,,,,http://revelnightlife.com,,,0,"Revel AC, Inc.",United States,Hospitality,1M - 10M,10 - 50,2011,,-74.41354,39.36172,active,,,['Google Tag Manager']
,,,,,,http://edison.it,,,0,Edison SpA,Italy,Utilities,> 1B,"5,000 - 10,000",1884,"Edison SpA is an Italy-based company involved in the production, procurement, distribution and sale of electric energy and natural gas. The Company's activities are divided into three business areas. The Electric Power Operations area is engaged in the production of electricity from renewable sources, such as thermoelectric power plants, wind farms, photovoltaic systems, biomass systems and hydroelectric power plants. The Hydrocarbons Operations area is engaged in the exploration and production of natural gas and crude oil, as well as owns hydrocarbon reserves and storage concessions. The Corporate Activities and Other Segments area includes financial operations of the Company.",,,active,9658601788,5430,"['CloudFlare', 'Drupal']"
,,,,,,http://fasal.co,,,0,Fasal,India,Information Technology and Services,0 - 1M,1 - 10,2018,"Climate-smart data-driven precision agriculture solution to increase yield, predict diseases, optimise resource utilization, microclimate weather forecast etc.",,,active,,,"['CloudFlare', 'Google Tag Manager']"
,,,,,,http://jinyoungfood.com,,,0,"Jinyoung Foods Co., Ltd.","Korea, Republic of",Food Production,,,1986,누구나 쉽게 무료로 만들수 있는 모바일 홈페이지,,,active,,,"['Amazon Cloudfront', 'Google Tag Manager']"
,,,,,,http://boschenlaw.com,,,1,The Boschen Law Firm,United States,,0 - 1M,1 - 10,,"For many people, leaving a legacy for the individuals they care about is an important part of a rewarding life. You can count on estate planning attorney, Kyle C. Boschen, to help you gain the peace of mind that comes when you know you have successfully left your family true security for the long",-104.933395,39.705574,active,,,[]
,,,,,,http://cajadecarton.es,,,0,cajadecarton.es,Spain,Packaging and Containers,0 - 1M,1 - 10,1993,"Fabricación y venta on-line a través de nuestro portal especializado en cajas de cartón y embalajes, www.cajadecarton.es.
Altamente especializados en cajas de cartón, embalajes y sistemas de protección para diversos sectores:
Cajas para envíos de tiendas on-line.
Cajas y materiales de embalaje para mudanzas, tanto particulares como profesionales.
Cajas de cartón a medida y personalizadas para empresas, fabricaciones en pequeñas y en grandes tiradas.

Principales materiales comercializados en stock permanente y entrega en 24 / 48 horas, envíos gratuitos en todos los pedidos superiores a 50 €:

Mas de 50 referencias de cajas de cartón de solapas
Mas de 40 referencias de cajas de cartón troqueladas automontables.
4 tipos de packs especiales para mudanzas
Papeleras de cartón para reciclaje o recogida de tapones de plástico y similares.
Cintas adhesivas, anónimas o impresas. Plásticos de burbujas. Film estirable. Sobres acolchados. Bolsas y sacos de plástico. Bolsas de cierre hermético. Cartón ondulado. Cantoneras. Flejes. 

Desde 1993 a su servicio.",,,active,,2,"['Amazon Cloudfront', 'Google Tag Manager', 'MaxCDN']"
,,,,,,http://fastenal.com,,,386,Fastenal Company,United States,Wholesale,> 1B,"> 10,000",1968,"Fastenal Company is engaged in wholesale distribution of industrial and construction supplies. The Company is engaged in fastener distribution, and non-fastener maintenance and supply business. As of December 31, 2016, it distributed these supplies through a network of approximately 2, 500 stores. Its customers are in the manufacturing and non-residential construction markets. The manufacturing market includes both original equipment manufacturers (OEM) and maintenance, repair, and operations (MRO). The non-residential construction market includes general, electrical, plumbing, sheet metal and road contractors. Other users of its products include farmers, truckers, railroads, oil exploration, production and refinement companies, mining companies, federal, state, and local governmental entities, schools and certain retail trades. Its original product offerings are fasteners and other industrial and construction supplies, many of which are sold under the Fastenal product name.",-91.6888,44.06424,active,5330000000,21950,"['Google Analytics', 'Google Tag Manager', 'Monetate']"
,,,,,,http://freearticles.io,,,0,Free Articles.IO,Philippines,Computer Software,0 - 1M,1 - 10,2021,"FreeArticles.IO works as an Article Directory platform with premium ezine article publication and monetization features.

Creators such as yourself has a chance to submit and publish their premium ezine articles and earn from it while we do the rest of the publication via freearticles.io portal.",,,active,,,['WordPress']
,,,,,,http://expediainc.com,,,7,"Expedia Group, Inc.",United States,Hospitality,> 1B,"> 10,000",2005,"Expedia Group, Inc., formerly Expedia, Inc., is an online travel company. The Company operates through four segments: Core Online Travel Agencies (Core OTA), trivago, Egencia and HomeAway. The Company's Core OTA segment provides a range of travel and advertising services to its customers across the world, through a range of brands, including Expedia.com and Hotels.com in the United States, and localized Expedia and Hotels.com Websites throughout the world, Orbitz.com, Expedia Affiliate Network, Hotwire.com, Travelocity, Wotif Group, CarRentals.com and Classic Vacations. The Company's trivago segment sends referrals to online travel companies and travel service providers from its hotel metasearch Websites. Its Egencia segment, which also includes Orbitz Worldwide (Orbitz) for Business, provides managed travel services to corporate customers across the world. The Company's HomeAway segment operates an online marketplace for the vacation rental industry.",-122.19624,47.613243,active,12070000000,25400,"['Amazon Cloudfront', 'BugHerd', 'CloudFlare', 'Google Analytics', 'Google Tag Manager', 'Piwik', 'WordPress']"
,,,,,,http://thinstoneveneers.com,,,1,La Pietra Inc.,United States,Building Materials,1M - 10M,10 - 50,2002,"We specialize in the sale and fabrication of Marble & Granite countertops and thinstone veneers that will transform and add life to any kitchen.  Our expertise is not limited to countertops alone; we also carry Limestone and Travertine among other materials that can be used in many areas of your home such as bathrooms and foyers.  We are your one stop shop for all of your natural stone needs.

Our products are durable and their lasting beauty seldom requires anything further once installation is complete but service after the sale is just as important, and you can count on that with us. Our greatest pride is serving the many family and friends referred to us year after year.  When you work with us, you become part of our family!

We have been serving the families and businesses of Fairfield County for quite some time.  Come visit one of our convenient locations in Brookfield, CT or Monroe, CT and meet with one of our talented designers to make your dreams a reality.",,,active,,,"['Google Analytics', 'MaxCDN', 'WooCommerce', 'WordPress']"
,,,,,,http://dmsccs.com,,,0,"DMS Construction Consulting Services, Inc.",United States,Construction,0 - 1M,1 - 10,2006,"Precise, accurate and dependable construction consulting. Specialising in cost estimating, value engineering, cost management, scheduling and expert witness/construction claims.",-76.85681,39.219196,active,,7,"['CloudFlare', 'Google Analytics', 'WordPress']"
,,,,,,http://sixelandschwinn.com,,,0,"SIXEL & SCHWINN, INC",United States,Construction,1M - 10M,10 - 50,1985,"Contact Sixel & Schwinn serving Sheboygan, WI, and surrounding areas - Supplying residential and commercial plumbing and electrical products.",-87.80079,43.818012,active,,21,['Amazon AWS S3']
,,,,,,http://cofchrist.org,,,1874,REORGANIZED CHURCH OF JESUS CHRIST OF LATTER DAY SAINTS,United States,Religious Institutions,0 - 1M,,1800,"Community of Christ is a worldwide church with a mission to “proclaim Jesus Christ and promote communities of joy, hope, love, and peace.”",-117.86125,33.77156,active,0,,"['AddThis', 'Akamai', 'CloudFlare', 'F5 BIG-IP', 'Google Analytics', 'Google DoubleClick', 'Google Tag Manager', 'Gravatar', 'MaxCDN', 'Omniture', 'PayPal', 'Varnish', 'WooCommerce', 'WordPress']"
,,,,,,http://windowcoveringsbyjean.com,,,0,"WINDOW COVERINGS BY JEAN, LLC",United States,,0 - 1M,1 - 10,2004,"Window Coverings By Jean is the source for all your interior design needs in Orlando, FL, including custom window shades, draperies, curtains and more.",-81.31484,28.493227,active,,,['Google Analytics']
,,,,,,http://gamlet.com,,,1,GAMLET INC,United States,Manufacturing,10M - 50M,50 - 200,1965,"Gamlet defines innovation through every part of our business. We will meet and exceed the expectations of our customers every day. In order to meet this goal, Gamlet provides the trained manpower and state-of-the-art facilities required to stay abreast of today’s ever-evolving marketplaces, technologies, and opportunities. Gamlet maintains the flexibility to diversify as our customer demand change and evolve.
Gamlet, Inc. strives to become a leader in the design and manufacture of custom metal components and fabrications, utilizing the most qualified, trained and dedicated employees and the finest equipment available. Gamlet will continue to penetrate new markets in order to grow its business and assist in offering existing and new customers not yet realized opportunities.",,,active,,65,"['Google Tag Manager', 'WooCommerce', 'WordPress']"
,,,,,,http://vistar.com,,,5,Vistar Corporation,United States,Food Production,0 - 1M,,1997,Global description for Vistar,-104.842415,39.59505,active,405000,,['Google Tag Manager']
,,,,,,http://zensar.com,,,0,Zensar Technologies Ltd,India,Computer Software,200M - 1B,"5,000 - 10,000",1963,"Zensar Technologies Limited (Zensar) is a India-based software and services company. It operates in two segments: Application Management Service and Infrastructure Management Service. It is focused on five industry verticals, such as manufacturing, retail, healthcare, banking, financial services and insurance. Its services range from the traditional to the transformational-enterprise product implementation and hosting, infrastructure management and testing, business intelligence and data warehousing, collaboration and knowledge management services, business process outsourcing and optimization, and the entire range of applications planning, portfolio building, development, migration and support. Its products and solutions include ZenPoSlite, AutoZenics, nXcchange, iCAn and ZenMobln.",,,active,552957453,6960,"['Google DoubleClick', 'Google Tag Manager', 'Optimizely']"
,,,,,,http://trustis.com,,,0,TRUSTIS LIMITED,United Kingdom,Computer Software,1M - 10M,10 - 50,1998,"Entrust keeps the world moving safely by enabling trusted experiences for identities, payments, and digital infrastructure. Explore our portfolio of solutions.",,,active,,,"['CloudFlare', 'Google Tag Manager', 'Maxymiser', 'Salesforce force.com', 'Salesforce Live Agent', 'Salesforce salesforce.com']"
,,,,,,,,,0,VITEC - Video Innovations,France,Computer Hardware,10M - 50M,50 - 200,1988,,,,active,,,[]
,,,,,,http://eksaccounting.com,,,0,EKS Accounting & Bookkeeping Inc.,Canada,Accounting,,,,"Small Business Accounting Services Calgary provided by Professional Accountant of EKS Accounting & Bookkeeping. We are Expert Tax Consultant provide Bookkeeping Services, Corporate Tax Advisor, Small Business Payroll Services Calgary.",-114.141579,51.03815700000001,active,,,"['Google Analytics', 'WordPress']"
,,,,,,http://burlingtonhealthcare.com,,,1,"Bhs, Inc.",United States,Retail,10M - 50M,50 - 200,1976,See related links to what you are looking for.,,,active,,,"['Google Analytics', 'Gravatar', 'WordPress']"
,,,,,,http://faac.co.uk,,,0,FAAC (UK) Limited,United Kingdom,Computer Hardware,,,1985,"FAAC are the market leaders in manufacturing automatic doors; our products include driveway and electric gates, access controls, swing gates and more.",,,active,,,"['CloudFlare', 'Google Tag Manager']"
,,,,,,http://juntadeandalucia.es,,,0,"Sociedad Andaluza para el Desarrollo de las Telecomunicaciones, S.A.",Spain,Telecommunications,,,,"Portal oficial de la Administración de la Junta de Andalucía. Accede a la información y servicios en sus áreas de competencia (educación, salud, empleo...).",,,active,,,"['Drupal', 'Google Analytics', 'Google Tag Manager', 'Piwik']"
,,,,,,http://unh.edu,,,0,Unh Foundation,United States,Higher Education,10M - 50M,50 - 200,,Give to the University of New Hampshire,-72.96215,41.292187,active,,,"['Drupal', 'Google Tag Manager']"
,,,,,,http://canva.com,,,0,"Canva, Inc.",Australia,Computer Software,10M - 50M,50 - 200,2012,"Canva is a free-to-use online graphic design tool. Use it to create social media posts, presentations, posters, videos, logos and more.",,,active,,,"['Amazon AWS S3', 'CloudFlare', 'Drupal', 'Gravatar', 'Optimizely', 'PayPal', 'TypeForm']"
,,,,,,http://zencargo.com,,,0,Zencargo,United Kingdom,Logistics and Supply Chain,10M - 50M,200 - 500,2017,"Zencargo is a digital first freight forwarder & logistics provider. Our platform allows customers to book, manage and keep track of their international freight as well as use analytics to drive intelligent supply chain decisions that help their businesses thrive.

Whilst shipping is a complex trillion dollar industry, you might be surprised to know that many of the processes that could be simplified with technology are currently done over the phone, by fax and email or even jotted down on scraps of paper

Our services include ocean, air and rail freight as well as trucking and cargo insurance. We deliver significant time, paper and financial savings to our customers offering instant quoting, easy booking and an online dashboard to give them 360 degree, 24/7 visibility on their shipments. Shippers and their counterparts collaborate to manage their logistics on Zencargo and all their supply chain data is stored together in the cloud making business analytics easier than ever. 

At Zencargo, we believe that technology can simplify logistical complexity and tear down barriers to trade. Automating trade and logistics operations and providing access to data and analysis will help companies to trade smarter and more efficiently, freeing businesses to concentrate on key decisions.  Only by combining human endeavour and technology, can we build smarter supply chains that know no borders. 

Interested in being a part of the journey? Zencargo is hiring so please do check our job postings!",,,active,,217,"['Google Tag Manager', 'WordPress']"
,,,,,,http://metalsupermarkets.co.uk,,,0,Metal Supermarkets,United Kingdom,,,,,"8 Locations in the UK. Aluminium, Steel, Stainless and More. No Minimum Orders and Cut to Your Exact Size! Pickup or Delivery Available.",-1.6147136,54.9285319,active,,,"['Google Tag Manager', 'MailChimp', 'WordPress']"
,,,,,,http://sadighimlaw.com,,,0,Law Offices of Ramtin Sadighim,United States,Legal Services,0 - 1M,1 - 10,,Ramtin Sadighim is a certified Los Angeles personal injury attorney and experienced car accident lawyer who isn't afraid to fight for his client's rights.,-118.53885,34.169926,active,,,"['Google Tag Manager', 'WordPress']"
,,,,,,http://nbinsagy.com,,,0,"THE NEW BRITAIN INSURANCE AGENCY, LLC",United States,Insurance,0 - 1M,1 - 10,1998,,,,active,,,[]
,,,,,,http://rockcontent.com,,,0,Rock Content,Brazil,Internet,50M - 100M,200 - 500,2013,Rock Content empowers brands to launch the best content experiences using our best in class products and services.,,,active,,,"['CloudFlare', 'Crazy Egg', 'Google Analytics', 'Google Tag Manager', 'Gravatar', 'HubSpot', 'Wingify/Visual Website Optimizer', 'WordPress']"
,,,,,,http://themart.gr,,,0,The Mart Cash & Carry S.A.,Greece,Wholesale,200M - 1B,"1,000 - 5,000",1992,"The Mart Cash &amp; Carry S.A. | 8,790 followers on LinkedIn | Η επαγγελματική επιλογή! | Η The Mart είναι από τις μεγαλύτερες εταιρείες χονδρεμπορικής. Δραστηριοποιείται στην Ελλάδα από το 1992 και από τον Ιανουάριο του 2015 ανήκει στον Όμιλο ΣΚΛΑΒΕΝΙΤΗΣ. Έχει σαν κύριο στόχο της την εξυπηρέτηση και τη συνεργασία με τους επαγγελματίες πελάτες της σε όλη την Ελλάδα.",,,active,,,"['Braintree', 'Google Tag Manager', 'Varnish']"
,,,,,,http://clarin.com,,,0,Clarín,Argentina,Publishing,> 1B,"5,000 - 10,000",1945,"Clarín es una compañía de medios con más de 70 años de experiencia, líder en prensa gráfica y digital de Argentina. A través de la calidad periodística de sus colaboradores y sus más de 25 productos editoriales, brinda servicios informativos que reflejan y analizan los principales intereses y preocupaciones de la sociedad. Asimismo, gracias a la incorporación de las últimas tecnologías y al profundo conocimiento de su audiencia, Clarín logra conectar una amplia variedad de contenidos de valor con las personas correctas, en el momento indicado y en el formato adecuado.",,,active,,,"['Chartbeat', 'CloudFlare', 'comScore', 'Google Analytics', 'Google DoubleClick', 'Google Tag Manager']"
,,,,,,http://flooranddecor.com,,,1,Floor & Decor Holdings Inc,United States,Retail,> 1B,"5,000 - 10,000",2010,"Floor & Decor Holdings, Inc., formerly FDO Holdings, Inc., is a retailer of hard surface flooring and related accessories. The Company retails its products such as tile, stone, wood, marble, glass and decoratives. The Company has 72 stores across 17 states in the United States. The Company provides its products to customers, including professional installers and commercial businesses (Pro), Do it Yourself customers (DIY) and customers who buy the products for professional installation (Buy it Yourself or BIY). The Company engages their customers both through trained store associates and designers who can assist in narrowing choices and making the process of home renovation easier. The Company also sells the products through its Website www.flooranddecor.com.",-84.45858,33.903748,active,2049999999,7320,"['Amazon Cloudfront', 'CloudFlare', 'Demandware', 'Google Tag Manager', 'Monetate', 'Salesforce force.com']"
,,,,,,http://bluecalypso.com,,,2,Blue Calypso Inc,United States,Internet,1M - 10M,10 - 50,2011,"Blue Calypso, Inc. develops and delivers mobile shopper marketing and analytics solutions for the business-to-consumer (B2C) marketplace leveraging mobile, social media, gamification and intellectual property portfolio. The Company's platform, KIOSENTRIX, provides manufacturers and brick-and-mortar retailers with a personalized way of engaging with store visitors when they are on the path-to-purchase. Its platform allows the collection of business intelligence and analytics resulting from data accumulated as content is deployed, adopted, consumed and shared. Its technology allows the brand/advertiser to monitor the full cycle of a campaign, from the first engagement to the final redemption or intent to purchase. In addition, the Company offers outsourced consulting and customized software development services through Blue Calypso Labs services.",-96.706024,32.997177,active,1300000,17,"['CloudFlare', 'Google Analytics', 'Sailthru', 'WooCommerce', 'WordPress']"
,,,,,,http://usermind.com,,,0,"Usermind, Inc.",United States,Computer Software,10M - 50M,50 - 200,2013,"Usermind provides the first unified platform for orchestrating the customer journey. With Usermind, companies can define and automate customer interactions to improve revenue, retention, and profitability. Built for non-developers, Usermind makes it simple to integrate enterprise applications, map data between them, automate end-to-end processes, measure their impact, and take instant action to improve business outcomes. With this infrastructure in place, enterprises can experiment and execute on customer experience with the agility of a startup.",-122.341446,47.613884,active,,65,"['Amazon Cloudfront', 'CloudFlare', 'Google DoubleClick', 'Google Tag Manager', 'HubSpot', 'Marketo']"
,,,,,,http://wars.pl,,,0,Wars S.A.,Poland,Food & Beverages,1M - 10M,10 - 50,1956,"Wars S.A. is a telecommunications company based out of 53 Józefa Chłopickiego, Warsaw, Masovian Voivodeship, Poland.",,,active,,50,"['WooCommerce', 'WordPress']"
,,,,,,,,,2,TAKATA CORPORATION,United States,Automotive,> 1B,"> 10,000",1997,,-122.67453,45.516464,active,,,[]
,,,,,,http://servientrega.com,,,0,"Servientrega, S.A.",Colombia,Package/Freight Delivery,,,,,,,active,,,[]
,,,,,,http://jotech.com.my,,,0,Jotech Holdings Bhd.,Malaysia,Machinery,,,,"Jotech specialise in metal parts production for Renewable Energy, Medical Equipment, E&E, Industrial parts industries. As a one-stop metal parts provider, Jotech can cater to customers for both low volume high mix as well as mass volume production requirements.",,,active,,,['WordPress']
