_id,link,last_seen,ispublished,views,deadline,company_name,content,source,branches_count,display_name,country,industry,revenue_range,employees_range,year_founded,description,longitude,latitude,company_status,revenue,employees_count,technologies_used
,,,,,,http://peri.com,,,0,PERI GmbH,Germany,Machinery,> 1B,"5,000 - 10,000",1969,"PERI | 134,243 followers on LinkedIn. Formwork, scaffolding, services and 3D printing from one single source. PERI is your reliable construction partner. | PERI is one of the leading manufacturers and suppliers of formwork and scaffold systems in the world. 

The family-owned company, with its headquarters in Weissenhorn (Germany), a workforce of 9,400 employees, more than 60 subsidiaries and well over 160 warehouse locations, provides its clients with innovative system equipment and comprehensive services relating to all aspects of formwork and scaffolding technology.

A powerful innovative strength, the high level of engineering service expertise and top quality materials ensure cost-effective, efficient and safe solutions for formwork and scaffolding projects around the globe.",,,active,,,"['Google Analytics', 'Google DoubleClick', 'Google Tag Manager']"
,,,,,,http://mahindrafinance.com,,,0,Mahindra and Mahindra Financial Services Ltd,India,Financial Services,> 1B,"> 10,000",1991,"Mahindra & Mahindra Financial Services Limited is a non-banking financial company (NBFC). The Company serves the financing needs of population residing in rural and semi-urban areas of India. The Company provides a range of retail products and services, such as financing vehicles for commercial and personal use, tractors, small and medium enterprise (SME) loans, and various other financial products. Through its housing finance subsidiary, Mahindra Rural Housing Finance Limited (MHRFL), the Company is enabling various low and middle income households to build their own home. The Company also provides mutual fund distribution, fixed deposit schemes and personal loans. The Company's subsidiary, Mahindra Insurance Brokers Limited, is in the business of distributing life and non-life insurance products through tie-ups with various insurance companies. It is a subsidiary of the Indian conglomerate, Mahindra & Mahindra (M&M).",,,active,1527739831,21790,"['CloudFlare', 'Google Tag Manager']"
,,,,,,http://ultratechapps.com,,,0,Aditya Birla Management Corporation Pvt. Ltd.,India,Think Tanks,100M - 200M,"500 - 1,000",1857,"Aditya Birla Management Corporation Pvt. Ltd. (ABMCPL) is the Aditya Birla Group's decision making body and provides strategic direction and vision to all its Group Companies. 

The Aditya Birla Group is an Indian multinational conglomerate, headquartered in Mumbai, India. It operates in 40 countries with more than 120,000 employees worldwide, belonging to 42 nationalities.

All the corporate functions at ABMCPL provides strategic functional leadership and specialist services to the Group Companies in India and Overseas.

Each corporate function comprises of domain experts / specialist resources in the respective field of study, and is hence the corporate power house of the Aditya Birla Group.

ABMCPL is a value adding activist center and within it; the corporate functions are the Centers of Excellence.  

These Corporate Centers define the portfolio strategy for the Group; 
both long term and short term and set governance for the group.",,,active,,,[]
,,,,,,http://korian.fr,,,3,Korian SA,France,Medical Devices,> 1B,"> 10,000",2003,"Korian SA, formerly Korian Medica SA, is a France-based company that operates healthcare facilities and medical establishments. The Company's holdings include residential centers for the elderly, offering permanent social care and medical support; follow-up care and rehabilitation centers, including general and specialized centers. Furthermore, the Company offers hospitalization at home, which avoids or shortens the hospitalization process; and home nursing services, which allows the care prescribes by a doctor at home. Korian-Medicas' establishments are located in France, Italy and Germany via its subsidiaries, Segesta S.p.A., Phonix GmBH, Reacti Malt SAS, Sas La Normandie, Sa La Bastide de la tourne, Sas Mapadex La Roseraie, among others.",,,active,3948760187,48600,"['CloudFlare', 'Drupal', 'Google Tag Manager', 'MaxCDN']"
,,,,,,http://focusdatasolutions.com,,,0,Focus Data Solutions,United States,Information Technology and Services,1M - 10M,10 - 50,2001,"An award winning services provider, Focus Data Solutions matches your business goals with the technology and management to see it through. We are your partner for everything IT, with the passion and technological expertise to easily develop and deliver solutions that will drive your business forward.

As a woman-owned business serving clients across all industries, Focus Data Solutions provides IT Essentials, IT Security, and IT Strategy and Consulting services in the Northern Virginia and D.C. metro area. More than simple a-la-carte solutions, Focus Data Solutions partners with you to provide comprehensive strategies that have been formulated for optimal IT maintenance and management.

For further information, visit us at www.focusdatasolutions.com or stop by our office in Alexandria, Virginia.",,,active,,,"['CloudFlare', 'Google Tag Manager', 'WordPress']"
,,,,,,http://binance.com,,,0,Binance Labs,Malta,,50M - 100M,200 - 500,2017,"Binance Labs is the venture arm of Binance, established to incubate, invest and empower blockchain and cryptocurrency entrepreneurs and communities",,,active,,,"['Google Analytics', 'Google Tag Manager']"
,,,,,,http://clunnacoustical.com,,,0,Clunn Acoustical Systems,United States,Construction,1M - 10M,10 - 50,1984,"Clunn Acoustical Systems was founded in 1984 with the belief that service, quality, and dependability would be the key to our success. For years now this formula has led us into being one of the leading Acoustical Contractors in our industry. Our reputation has allowed us to prove ourselves time and time again as a company that you can depend on. Whether it be on making impossible schedules a reality or on bid day with value engineering that saves your clients money and helps you win bids. We are firm believers that you are only as good as your last job.
   
   Our specialties include all ceiling applications whether it be acoustical, linear metal, luminous ceilings or acoustical wall treatment.
   
   Our estimating department will be glad to assist in conceptual design, establishing budget, providing samples and mock-ups for your customer's selection, as well as working with designers, architects, and owners.
   
   Clunn Acoustical's trained staff of installers will set you at ease as their experience unfolds. Field problems are easily resolved and our staff helps eliminate and identify potential problems, which saves our clients time and money. Our safety record is one of the best in the industry and we promote job safety.

   Our company continues to prosper and be a leading Acoustical Contractor in the industry and welcomes the opportunity to be part of your team.",-95.65655,30.131699,active,,,"['Google Analytics', 'Google DoubleClick', 'Google Tag Manager']"
,,,,,,http://thecrossingcompany.com,,,2,The Crossing Company Incorporated,Canada,Construction,,,1997,"Replace or repair underground pipelines and utilities with The Crossing Group— North America's leaders in Horizontal Directional Drilling, Tunneling and Hydrovac. Servicing the energy sector, utility and marine construction industries.",,,active,,,"['CloudFlare', 'Google Tag Manager', 'MaxCDN', 'WordPress']"
,,,,,,http://manitou.com,,,3,"Manitou Americas, Inc.",United States,Machinery,100M - 200M,"1,000 - 5,000",1859,"Manitou designs, assembles and distributes professional handling equipment around the world.",,,active,,1078,"['CloudFlare', 'Drupal', 'Google DoubleClick', 'Google Tag Manager', 'WordPress']"
,,,,,,http://sveassociates.com,,,2,SVE ASSOCIATES,United States,Civil Engineering,1M - 10M,10 - 50,2015,"SVE Associates is a professional consulting firm of engineers, surveyors and landscape architects that has served central New England since 1969. With offices in Vermont, New Hampshire, and Massachusetts, SVE Associates has the local and regional knowledge and experience to successfully execute a variety of projects from conception to completion.

Our clients range from single family home owners to municipalities, state and federal governments, institutions, commercial and industrial complexes and real estate developers. Services include:

    • Civil, environmental and transportation engineering
    • Boundary, topographic and GPS surveying
    • Jurisdictional Wetland delineations and permitting
    • Site planning and land use planning
    • Landscape architecture
    • Structural engineering
    • Federal, state and local permitting.",-72.57592,42.8788,active,,,[]
,,,,,,http://stardoll.com,,,0,Stardoll AB,Sweden,Computer Software,0 - 1M,1 - 10,2002,"Dress up games for girls at Stardoll. Dress up celebrities and style yourself with the latest trends. Stardoll, the world's largest community for girls who love fame, fashion and friends.",,,active,,,['Google DoubleClick']
,,,,,,http://skydrive.live.com,,,0,Laf Moda Intima,Brazil,Retail,,,,,-43.9427834,-19.8473591,active,,,[]
,,,,,,http://jasminewomenscenter.com,,,0,"JASMINE WOMEN'S CENTER, OBSTETRICS & GYNECOLOGY, LLC",United States,Hospital & Health Care,0 - 1M,1 - 10,2012,"Jasmine Women's Center is a new OB/GYN office created to meet the needs of Women through community outreach, advocacy and teaching.",-84.335724,30.501925,active,,,['Google Analytics']
,,,,,,http://peachtreewomensclinic.com,,,3,"PEACHTREE WOMEN'S CLINIC, LLC",United States,Hospital & Health Care,1M - 10M,10 - 50,2012,"Peachtree Women's Clinic provides women's health services (obstetrics, gynecology, surgery) in Atlanta, Midtown, Alpharetta, and Cumming, Canton.",-84.35301,33.911892,active,,,['Google Tag Manager']
,,,,,,http://nytco.com,,,8,New York Times Co,United States,Publishing,> 1B,"1,000 - 5,000",1896,"The New York Times Company is a media company focused on creating, collecting and distributing news and information. The Company's principal business consists of distributing content generated by its newsroom through its print, Web and mobile platforms. In addition, it distributes selected content on third-party platforms. The Company includes newspapers, print and digital products and investments. The Company's businesses include newspapers, such as The New York Times (The Times); Websites, including NYTimes.com; mobile applications, including The Times's news applications, as well as interest-specific applications, such as NYT Cooking, Crossword and others, and related businesses, such as The Times news services division, product review and recommendation Websites The Wirecutter and The Sweethome, digital archive distribution, NYT Live (its live events business) and other products and services under The Times brand.",-73.990685,40.756,active,1810000000,4500,"['Amazon Cloudfront', 'Google Analytics', 'Google DoubleClick', 'Google Tag Manager', 'NewRelic', 'Optimizely', 'Shopify', 'WordPress']"
,,,,,,http://wito.pro,,,0,WITO,France,Construction,1M - 10M,10 - 50,2010,"Wito, rénovation haut de gamme d'appartement et réalisation de second œuvre à Paris et dans la région parisienne.",,,active,5500000,,['Google Analytics']
,,,,,,http://yahoo.com,,,0,Yahoo Koubei,China,Computer Software,,,2008,A new welcome to Yahoo. The new Yahoo experience makes it easier to discover the news and information that you care about most. It's the web ordered for you.,,,active,,,"['comScore', 'Foresee', 'Google DoubleClick', 'MarkMonitor', 'Omniture']"
,,,,,,,,,1,King Medical,United States,Management Consulting,0 - 1M,1 - 10,2001,,-75.751958,39.61595,active,,,[]
,,,,,,http://arcor.com.ar,,,0,Arcor S.A.I.C.,Argentina,Food Production,,,1951,"Te invitamos a descubrir información de productos y marcas, novedades de lanzamientos y promociones, tips de alimentación para una vida equilibrada, recetas de Arcor Cocina y mucho más",,,active,,,['Google Tag Manager']
,,,,,,http://promoest.com,,,0,Promoest,Italy,Events Services,1M - 10M,10 - 50,1991,"Promoest è un'agenzia di Eventi, Congressi e Traduzioni con sedi a Milano, Genova e Shangai. Da oltre 30 anni al servizio del cliente",,,active,,,"['Google Tag Manager', 'WordPress']"
,,,,,,http://paricott.com,,,0,PARICOTT INDIA PAPERCUP PRIVATE LIMITED,India,Paper & Forest Products,1M - 10M,10 - 50,2000,"We are leading paper cups manufacturers in India since 2000. Paricott offering all kinds of Biodegrade paper cups manufacturing includes Hot cups, Cold cups and more.",,,active,,,['Google Tag Manager']
,,,,,,http://naturallivingideas.com,,,0,Natural Living Ideas,,"Health, Wellness and Fitness",,,,Ideas To Live A More Natural Life,,,active,,,"['AWeber', 'Google Tag Manager', 'WooCommerce', 'WordPress']"
,,,,,,,,,18,Brenntag SA,France,Wholesale,200M - 1B,"500 - 1,000",1947,,,,active,600000000,,[]
,,,,,,http://wito.pro,,,0,WITO,France,Construction,1M - 10M,10 - 50,2010,"Wito, rénovation haut de gamme d'appartement et réalisation de second œuvre à Paris et dans la région parisienne.",,,active,5500000,,['Google Analytics']
,,,,,,http://zojirushi.com,,,1,Zojirushi America Corporation,United States,Computer Hardware,1M - 10M,10 - 50,1987,"Zojirushi was established in 1918 as a producer of hand-blown vacuum bottles and has been a world leader in thermal products ever since. The Zojirushi line was expanded to include a wide range of stainless steel vacuum bottles, rice cookers, breadmakers, Air Pot® beverage dispensers, thermal serving carafes, specialty cookware, small electrics, restaurant equipment, and other products. 

In 2018, Zojirushi celebrated its 100th anniversary, and a century of products designed to improve customers' quality of life—bringing comfort, ease, vitality and affluence to people around the world. Striving to remain faithful to the principles that embodied the company's first 100 years, and the reputation of quality and durability it earned them, Zojirushi looks forward to a future of continued innovation and inspired design.",-118.29579,33.858322,active,,44,"['Google Analytics', 'Google Tag Manager']"
,,,,,,,,,0,Apollo Scientific Group,Ukraine,Pharmaceuticals,,,,,,,active,,,[]
,,,,,,http://wix.com,,,0,Wix.Com Ltd,Israel,Internet,200M - 1B,"1,000 - 5,000",2006,"Wix.com Ltd. (Wix) is a Web development platform enabling businesses and organizations to take businesses, brands and workflow online. The Company provides solutions that business owners can use to operate various aspects of their business online, such as selling goods, taking reservations, and scheduling and confirming appointments. These applications provide Wix registered users a bespoke front-end for customers visiting their Website, as well as a back-end management dashboard. The Company has developed these software applications for businesses in specific verticals, including retail and online stores, service providers, hotel and property management, music and restaurants. These vertical applications are integrated into the Company's Website templates or can be installed on any existing Website and set up by the user and without the need to write code.",,,active,761090000,2430,"['Amazon Cloudfront', 'Crazy Egg', 'Google Analytics', 'Google DoubleClick', 'Google Tag Manager', 'Incapsula']"
,,,,,,http://sk.co.kr,,,0,SK Holdings,"Korea, Republic of",Oil & Energy,> 1B,"> 10,000",1962,"SK Holdings Co., Ltd. operates as a holding company which provides information technology services, distributes natural gas, manufactures petrochemicals, and develops biopharmaceuticals. It also provides architecture services & civil engineering services. The company was founded on April 13, 1991 and is headquartered at Seoul, South Korea.",,,active,,104374,['Google Tag Manager']
,,,,,,,,,0,BDO in Australia,Australia,Accounting,200M - 1B,"1,000 - 5,000",1975,"BDO is a trusted adviser to clients seeking audit, tax and advisory services. As one of the world’s leading audit and accounting organisations, we have clients of all types and sizes from large corporate organisations to private businesses, entrepreneurs and individuals across an array of industry sectors. 

At BDO, we are guided by our values that are the foundation of what we deliver: IDEAS | PEOPLE | TRUST. 

This is about delivering ideas and advice that create value; quality-driven people who are motivated by providing exceptional client service; and being trusted to get the job done. 

Talk to us today.",,,active,,1549,[]
,,,,,,http://tdk.com,,,0,T D K Components Usa,United States,Computer Hardware,10M - 50M,50 - 200,1986,"Welcome to TDK corporate website. TDK is the world’s leading electronic components and devices company that has the high magnetics technology. We contribute to develop the world culture and industry through high-level creativity. This website contains information about company, CSR, IR, and Job Opportunities.",,,active,,162,"['Drupal', 'Google Analytics', 'Google Tag Manager', 'NewRelic']"
,,,,,,,,,1,Hammond Lumber Company - Fairfield,United States,Retail,1M - 10M,10 - 50,,,-69.596757,44.586441,active,,,[]
,,,,,,http://meccon.com,,,5,Meccon Industries Inc,United States,Machinery,10M - 50M,50 - 200,1967,"Meccon Industries, Inc. is a privately owned industrial contractor specializing in the fabrication and installation of fiberglass, carbon steel, stainless steel, copper, titanium and other alloy pipe materials for low and high temperature and pressure systems.  We have a 39 year history of constructing new system installations and performing modifications to existing systems for the automotive, aviation, chemical, food, oil, steel and waste water treatment industries and continue to perform as one of the largest mechanical contractors in the Midwest.",-87.55158,41.579243,active,,160,['Amazon Cloudfront']
,,,,,,http://deliveryhero.com,,,0,Delivery Hero SE,Germany,Retail,200M - 1B,"> 10,000",2011,"Delivery Hero SE is a Germany-based company, which is primarily engaged in the food industry. The Company operates as a provider of online food delivery services from restaurants and cafes. The Company offers pizza, burger, organic food, vegan cuisine, and Asian dishes, among others. Its portfolio of brands comprises Foodpanda, Lieferheld, Foodora, PedidosYa, Clickdelivery, Talabat, Yemeksepeti, Donesi, Pauza, Hungerstation, Hellofood, Otlob and others. The Company operates globally, on the territory of more than 40 countries, comprising Europe, the Middle East, North Africa, Asia, and the Americas. The Company's services are available through Web version and mobile application.",,,active,914449727,22950,"['CloudFlare', 'Google Analytics', 'WordPress']"
,,,,,,http://lexalytics.com,,,1,"Lexalytics, Inc.",United States,Computer Software,1M - 10M,10 - 50,2003,Flexible natural language processing APIs and complete text analytics platform solutions for data analytics companies and data analyst teams.,-72.53282,42.373714,active,,22,"['Eloqua', 'Google Analytics', 'Google DoubleClick', 'Google Tag Manager', 'Pardot']"
,,,,,,http://nofap.com,,,0,NoFap LLC,United States,"Health, Wellness and Fitness",0 - 1M,1 - 10,2014,"NoFap® is a website that helps people develop healthier sexual habits through quitting pornography. This results in awesomer lives with improved interpersonal relationships. For more information about us, please visit NoFap.com/about. Connect with NoFap: -https://www.twitter.com/NoFap -http://www.facebook.com/NoFapArmy -http://www.reddit.com/r/NoFap",-79.91759,40.477936,active,,,"['Google Analytics', 'Google Tag Manager', 'InfusionSoft', 'WooCommerce', 'WordPress']"
,,,,,,http://primofoods.com,,,1,Primo Foods Inc.,Canada,Food Production,0 - 1M,1 - 10,1954,,,,active,,,['Google Analytics']
,,,,,,http://deegit.com,,,0,Deegit Inc,United States,Computer Software,10M - 50M,200 - 500,1993,Provides software consulting and development services to clients offshore and onsite.,-88.03217,42.050785,active,30394658,425,[]
,,,,,,http://opisnet.com,,,2,"Oil Price Information Service, LLC",United States,Financial Services,10M - 50M,200 - 500,1977,"OPIS, a Dow Jones company, provides accurate price discovery, news and expert analysis across the entire fuel supply chain, including the Spot, Wholesale Rack and Retail markets. OPIS enables customers to buy and sell energy commodities with confidence by providing easy access to reliable, transparent data, expert-level customer support, educational events, and pricing and analytics solutions like McCloskey, PetroChem Wire and Axxis Software.",-77.19407,39.113876,active,,,"['BugHerd', 'Google Analytics', 'Google Tag Manager', 'HubSpot', 'Wistia', 'WordPress']"
,,,,,,http://hydrosult.com,,,0,Hydrosult inc.,Canada,Management Consulting,0 - 1M,1 - 10,1980,This domain may be for sale!,,,active,,,['Amazon Cloudfront']
,,,,,,http://mebank.ir,,,0,Mehr Eqtesad Bank,"Iran, Islamic Republic of",Banking,,,,,,,active,,,['Google DoubleClick']
,,,,,,http://starcutter.com,,,0,Star Cutter Company,United States,Machinery,50M - 100M,"500 - 1,000",1927,"Star Cutter Company was founded in 1927 by Howard B. Lawton and Frank Burgess. The company was started in a leased portion of a building on Epworth Boulevard in Detroit, Michigan. During this first year of operation Star Cutter Company employed ten employees. The main customers in 1927 were Chrysler and Chevrolet Gear and Axle.

Star Cutter Company has developed into a world leader in the cutting tool industry with over 500 employees working in six manufacturing facilities within five manufacturing divisions. Each manufacturing facility specializes in producing a specific type of product or service: solid carbide cutting tools, carbide blanks and preforms, gundrills, gear cutting tools, and 5-axis CNC tool and cutter grinding machines.

Headquartered in Farmington Hills, MI, the Star Cutter Company partners with Star SU LLC for marketing, sales, and service of its products in North America, South America, Europe and Asia.",-83.42372,42.463737,active,,609,"['Google Tag Manager', 'WooCommerce', 'WordPress']"
,,,,,,http://wbtla.org,,,1,KARSH FAMILY SOCIAL SERVICE CENTER INC,United States,Civic & Social Organization,0 - 1M,1 - 10,1862,"Learn about the Karsh Center's four program areas: Parent & Child Wellbeing, Legal Services, Food & Nutrition Security, and Health & Wellness. These programs form a safety net for the Koreatown community, to help build a future in which every member of our community can thrive.",-118.30421,34.06354,active,427110,5,"['CloudFlare', 'Google Analytics', 'Google Tag Manager', 'ShareThis', 'WordPress']"
,,,,,,,,,0,Aurelius Hospital Nilai,Malaysia,Hospital & Health Care,1M - 10M,10 - 50,1999,"Established in 1999, Aurelius Hospital Nilai was Malaysia’s first private specialist centre with two core areas of focus: clinical research and cancer treatment using Varian’s Trilogy System for precision radiotherapy treatment. It was formerly known as NCI Cancer Hospital following its acquisition by TH Group and was renamed Nilai Medical Centre in 2012 in line with its expansion as a full-fledged multi-disciplinary private medical hospital, to cater to the needs of the Nilai community and surrounding areas.

Since joining the Aurelius Healthcare family in 2021, Nilai Medical Centre has been rebranded to Aurelius Hospital Nilai. Incorporated in 2019, Aurelius Healthcare specialises in primary, tertiary, and quaternary healthcare management and services. Proudly founded in Malaysia through global healthcare management experience, our readiness to offer customised and world-class hospital management for new facilities or modernising established healthcare assets is made possible through our extensive network of in-house industry experts. Aurelius Healthcare’s tertiary hospitals have all the medical and surgical specialities that meet the full spectrum of healthcare needs of local and international patients.

The team at Aurelius Hospital Nilai is committed to delivering exceptional, patient-centric care in alignment with the standard that can be expected from Aurelius Healthcare name. Our collective aim is to create a warm, personal and caring environment to ensure the best possible care for patients and their loved ones.",,,active,,,[]
,,,,,,http://auroracap.com,,,0,AURORA CAPITAL PARTNERS L.P.,United States,Venture Capital & Private Equity,1M - 10M,10 - 50,1991,"Aurora Capital Partners works together with successful management teams to build market-leading companies through investments in growth initiatives, strategic positioning and add-on acquisitions. 

Complementing the experience of our investment professionals, Aurora's Executive Board and Executive Network provide a tremendous depth of resources to our companies. Along with management, our team identifies and supports key strategic and operational priorities.  Our objective is to provide our management partners with the capital and working environment they need to grow and succeed.

We invest across three sectors: Business Services & Distribution, Engineered Products, and Software & Data-enabled Services.",-118.44224,34.05922,active,,,"['Google Tag Manager', 'MaxCDN']"
